<?xml version="1.0"?>
<!DOCTYPE eml-file PUBLIC "-//NCEAS//eml-file//EN" "file:///PROGRAM FILES/MORPHO/catalog/eml-file.dtd" >
<eml-file description="Data structural descriptors">
<meta_file_id description="Unique identifier of this metadata record">
 </meta_file_id>
<file description="Data set file">
<file_name description="File name">build.xml</file_name>
<file_size description="Size of file">
<amount description="Amount">
 </amount>
<unit description="Unit">
 </unit>
</file_size>
<format description="File type and compression schemes employed">
<compressed description="Method of compression">
 </compressed>
 <ASCII description="ASCII">
<record_delimiter description="Record delimiter">
 </record_delimiter>
</ASCII>
<Empty >
</Empty>
</format>
<orientation columnorrow="(columnmajor,rowmajor)columnmajor"  description="Is file column major or row major?">
<Empty >
</Empty>
</orientation>
<header_lines description="Number of header lines or information that prepares data">
 </header_lines>
<case_sensitive description="Case sensitivity of field"  yesorno="(y,n)n">
<Empty >
</Empty>
</case_sensitive>
<geographic_coverage description="Geographic coverage">
<paragraph description="Paragraph of  ">
 </paragraph>
<coordinates description="Cartesian Coordinates">
<lattitude direction="(north,south)"  description="Lattitude coordinates">
 </lattitude>
<longitude direction="(east,west)"  description="Longitude coordinates">
 </longitude>
</coordinates>
</geographic_coverage>
<temporal_coverage description="Temporal coverage">
<start_date description="Date data collection commenced">
<datetime description="Date and time as designated in ISO 8601">
<year description="Year in YYYY format">
 </year>
<month description="Month in MM format">
 </month>
<day description="Day of month in DD format">
 </day>
<hour description="Hour in hh">
 </hour>
<minute description="Minute in mm">
 </minute>
<second description="Seconds in ss">
 </second>
<second_fraction description="One or more digits representing a decimal fraction of a second">
 </second_fraction>
<time_zone_designator description="Time zone designator">
 </time_zone_designator>
</datetime>
</start_date>
<stop_date description="Date data collection terminated">
<datetime description="Date and time as designated in ISO 8601">
<year description="Year in YYYY format">
 </year>
<month description="Month in MM format">
 </month>
<day description="Day of month in DD format">
 </day>
<hour description="Hour in hh">
 </hour>
<minute description="Minute in mm">
 </minute>
<second description="Seconds in ss">
 </second>
<second_fraction description="One or more digits representing a decimal fraction of a second">
 </second_fraction>
<time_zone_designator description="Time zone designator">
 </time_zone_designator>
</datetime>
</stop_date>
</temporal_coverage>
<authentication description="Authentication procedures or techniques">
 </authentication>
<data_problem problemtype="(missing,anomaly,error)"  description="Data anomalies; description of missing data">
<paragraph description="Paragraph of  ">
 </paragraph>
</data_problem>
</file>
</eml-file>
